Symbolic_Maths,Natural_Language
R âˆª (Y âˆ© Z) = (R âˆª Y) âˆ© (R âˆª Z),Union distributes over intersection: R âˆª (Y âˆ© Z) = (R âˆª Y) âˆ© (R âˆª Z)
T âˆª (U âˆ© A) = (T âˆª U) âˆ© (T âˆª A),Union distributes over intersection: T âˆª (U âˆ© A) = (T âˆª U) âˆ© (T âˆª A)
T âˆª (V âˆ© Q) = (T âˆª V) âˆ© (T âˆª Q),Union distributes over intersection: T âˆª (V âˆ© Q) = (T âˆª V) âˆ© (T âˆª Q)
T âˆª (Z âˆ© R) = (T âˆª Z) âˆ© (T âˆª R),Union distributes over intersection: T âˆª (Z âˆ© R) = (T âˆª Z) âˆ© (T âˆª R)
U âˆª (B âˆ© S) = (U âˆª B) âˆ© (U âˆª S),Union distributes over intersection: U âˆª (B âˆ© S) = (U âˆª B) âˆ© (U âˆª S)
U âˆª (S âˆ© V) = (U âˆª S) âˆ© (U âˆª V),Union distributes over intersection: U âˆª (S âˆ© V) = (U âˆª S) âˆ© (U âˆª V)
U âˆª (U âˆ© X) = (U âˆª U) âˆ© (U âˆª X),Union distributes over intersection: U âˆª (U âˆ© X) = (U âˆª U) âˆ© (U âˆª X)
V âˆª (W âˆ© Q) = (V âˆª W) âˆ© (V âˆª Q),Union distributes over intersection: V âˆª (W âˆ© Q) = (V âˆª W) âˆ© (V âˆª Q)
V âˆª (Y âˆ© B) = (V âˆª Y) âˆ© (V âˆª B),Union distributes over intersection: V âˆª (Y âˆ© B) = (V âˆª Y) âˆ© (V âˆª B)
W âˆª (Y âˆ© T) = (W âˆª Y) âˆ© (W âˆª T),Union distributes over intersection: W âˆª (Y âˆ© T) = (W âˆª Y) âˆ© (W âˆª T)
X âˆª (A âˆ© C) = (X âˆª A) âˆ© (X âˆª C),Union distributes over intersection: X âˆª (A âˆ© C) = (X âˆª A) âˆ© (X âˆª C)
X âˆª (P âˆ© P) = (X âˆª P) âˆ© (X âˆª P),Union distributes over intersection: X âˆª (P âˆ© P) = (X âˆª P) âˆ© (X âˆª P)
X âˆª (P âˆ© S) = (X âˆª P) âˆ© (X âˆª S),Union distributes over intersection: X âˆª (P âˆ© S) = (X âˆª P) âˆ© (X âˆª S)
X âˆª (Q âˆ© V) = (X âˆª Q) âˆ© (X âˆª V),Union distributes over intersection: X âˆª (Q âˆ© V) = (X âˆª Q) âˆ© (X âˆª V)
X âˆª (U âˆ© V) = (X âˆª U) âˆ© (X âˆª V),Union distributes over intersection: X âˆª (U âˆ© V) = (X âˆª U) âˆ© (X âˆª V)
Y âˆª (A âˆ© W) = (Y âˆª A) âˆ© (Y âˆª W),Union distributes over intersection: Y âˆª (A âˆ© W) = (Y âˆª A) âˆ© (Y âˆª W)
Y âˆª (Q âˆ© A) = (Y âˆª Q) âˆ© (Y âˆª A),Union distributes over intersection: Y âˆª (Q âˆ© A) = (Y âˆª Q) âˆ© (Y âˆª A)
Y âˆª (S âˆ© C) = (Y âˆª S) âˆ© (Y âˆª C),Union distributes over intersection: Y âˆª (S âˆ© C) = (Y âˆª S) âˆ© (Y âˆª C)
Y âˆª (V âˆ© B) = (Y âˆª V) âˆ© (Y âˆª B),Union distributes over intersection: Y âˆª (V âˆ© B) = (Y âˆª V) âˆ© (Y âˆª B)
Y âˆª (X âˆ© Y) = (Y âˆª X) âˆ© (Y âˆª Y),Union distributes over intersection: Y âˆª (X âˆ© Y) = (Y âˆª X) âˆ© (Y âˆª Y)
Z âˆª (A âˆ© V) = (Z âˆª A) âˆ© (Z âˆª V),Union distributes over intersection: Z âˆª (A âˆ© V) = (Z âˆª A) âˆ© (Z âˆª V)
Z âˆª (B âˆ© S) = (Z âˆª B) âˆ© (Z âˆª S),Union distributes over intersection: Z âˆª (B âˆ© S) = (Z âˆª B) âˆ© (Z âˆª S)
Z âˆª (U âˆ© A) = (Z âˆª U) âˆ© (Z âˆª A),Union distributes over intersection: Z âˆª (U âˆ© A) = (Z âˆª U) âˆ© (Z âˆª A)
Disjoint V Vá¶œ,V and its complement are disjoint
V âŠ† A,V is a subset of A
V âŠ† P,V is a subset of P
V âŠ† Q,V is a subset of Q
V âŠ† U,V is a subset of U
V âŠ† X,V is a subset of X
V âŠ† Z,V is a subset of Z
V âˆˆ ğ’«(V),V is an element of its own power set
V âˆ© (V âˆª S) = V,Vbsorption law for intersection: V âˆ© (V âˆª S) = V
V âˆª (V âˆ© U) = V,Vbsorption law for union: V âˆª (V âˆ© U) = V
W âŠ† P,W is a subset of P
W âŠ† Y,W is a subset of Y
W âˆ© (W âˆª C) = W,Wbsorption law for intersection: W âˆ© (W âˆª C) = W
W âˆ© (W âˆª Z) = W,Wbsorption law for intersection: W âˆ© (W âˆª Z) = W
W âˆª (W âˆ© P) = W,Wbsorption law for union: W âˆª (W âˆ© P) = W
W âˆª (W âˆ© R) = W,Wbsorption law for union: W âˆª (W âˆ© R) = W
Disjoint X Xá¶œ,X and its complement are disjoint
X âŠ† U,X is a subset of U
X âŠ† Y,X is a subset of Y
X âŠ† X âˆª S,X is a subset of the union of X and S
X âˆˆ ğ’«(X),X is an element of its own power set
X âˆ© (X âˆª R) = X,Xbsorption law for intersection: X âˆ© (X âˆª R) = X
X âˆª (X âˆ© R) = X,Xbsorption law for union: X âˆª (X âˆ© R) = X
Y âŠ† Y âˆª A,Y is a subset of the union of Y and A
Y âˆ© (Y âˆª W) = Y,Ybsorption law for intersection: Y âˆ© (Y âˆª W) = Y
Y âˆª (Y âˆ© U) = Y,Ybsorption law for union: Y âˆª (Y âˆ© U) = Y
Y âˆª (Y âˆ© V) = Y,Ybsorption law for union: Y âˆª (Y âˆ© V) = Y
Y âˆª (Y âˆ© W) = Y,Ybsorption law for union: Y âˆª (Y âˆ© W) = Y
Disjoint Z Zá¶œ,Z and its complement are disjoint
Z âŠ† A,Z is a subset of A
Z âŠ† T,Z is a subset of T
Z âŠ† W,Z is a subset of W
Z âŠ† Z âˆª S,Z is a subset of the union of Z and S
Z âˆˆ ğ’«(Z),Z is an element of its own power set
a âˆˆ C \ W,a is an element of C but not in W
a âˆˆ T \ Q,a is an element of T but not in Q
a âˆˆ U âˆª Y â†” (a âˆˆ U âˆ¨ a âˆˆ Y),a is an element of U union Y if and only if a is an element of U or a is an element of Y
a âˆˆ X âˆª Z â†” (a âˆˆ X âˆ¨ a âˆˆ Z),a is an element of X union Z if and only if a is an element of X or a is an element of Z
a âˆˆ Y âˆª Q â†” (a âˆˆ Y âˆ¨ a âˆˆ Q),a is an element of Y union Q if and only if a is an element of Y or a is an element of Q
a âˆˆ Z âˆª B â†” (a âˆˆ Z âˆ¨ a âˆˆ B),a is an element of Z union B if and only if a is an element of Z or a is an element of B
a âˆˆ Rá¶œ â†” a âˆ‰ R,a is an element of the complement of R if and only if a is not in R
a âˆˆ Wá¶œ â†” a âˆ‰ W,a is an element of the complement of W if and only if a is not in W
a âˆˆ Xá¶œ â†” a âˆ‰ X,a is an element of the complement of X if and only if a is not in X
a âˆˆ A âˆ© R â†” (a âˆˆ A âˆ§ a âˆˆ R),a is an element of the intersection of A and R if and only if a is in both A and R
a âˆˆ C âˆ© R â†” (a âˆˆ C âˆ§ a âˆˆ R),a is an element of the intersection of C and R if and only if a is in both C and R
a âˆˆ C âˆ© Y â†” (a âˆˆ C âˆ§ a âˆˆ Y),a is an element of the intersection of C and Y if and only if a is in both C and Y
a âˆˆ C âˆ© Z â†” (a âˆˆ C âˆ§ a âˆˆ Z),a is an element of the intersection of C and Z if and only if a is in both C and Z
a âˆˆ P âˆ© C â†” (a âˆˆ P âˆ§ a âˆˆ C),a is an element of the intersection of P and C if and only if a is in both P and C
a âˆˆ U âˆ© W â†” (a âˆˆ U âˆ§ a âˆˆ W),a is an element of the intersection of U and W if and only if a is in both U and W
a âˆˆ V âˆ© T â†” (a âˆˆ V âˆ§ a âˆˆ T),a is an element of the intersection of V and T if and only if a is in both V and T
a âˆˆ W âˆ© B â†” (a âˆˆ W âˆ§ a âˆˆ B),a is an element of the intersection of W and B if and only if a is in both W and B
a âˆˆ X âˆ© A â†” (a âˆˆ X âˆ§ a âˆˆ A),a is an element of the intersection of X and A if and only if a is in both X and A
a âˆˆ Z âˆ© T â†” (a âˆˆ Z âˆ§ a âˆˆ T),a is an element of the intersection of Z and T if and only if a is in both Z and T
a âˆ‰ C,a is not a member of set C
a âˆ‰ T,a is not a member of set T
b âˆˆ A âˆª Q â†” (b âˆˆ A âˆ¨ b âˆˆ Q),b is an element of A union Q if and only if b is an element of A or b is an element of Q
b âˆˆ C \ P,b is an element of C but not in P
b âˆˆ P \ X,b is an element of P but not in X
b âˆˆ Q âˆª Y â†” (b âˆˆ Q âˆ¨ b âˆˆ Y),b is an element of Q union Y if and only if b is an element of Q or b is an element of Y
b âˆˆ T âˆª R â†” (b âˆˆ T âˆ¨ b âˆˆ R),b is an element of T union R if and only if b is an element of T or b is an element of R
b âˆˆ V \ R,b is an element of V but not in R
b âˆˆ W \ C,b is an element of W but not in C
b âˆˆ W \ X,b is an element of W but not in X
b âˆˆ Aá¶œ â†” b âˆ‰ A,b is an element of the complement of A if and only if b is not in A
b âˆˆ C âˆ© X â†” (b âˆˆ C âˆ§ b âˆˆ X),b is an element of the intersection of C and X if and only if b is in both C and X
b âˆˆ R âˆ© P â†” (b âˆˆ R âˆ§ b âˆˆ P),b is an element of the intersection of R and P if and only if b is in both R and P
b âˆˆ Z âˆ© X â†” (b âˆˆ Z âˆ§ b âˆˆ X),b is an element of the intersection of Z and X if and only if b is in both Z and X
b âˆ‰ A,b is not a member of set A
b âˆ‰ C,b is not a member of set C
b âˆ‰ P,b is not a member of set P
b âˆ‰ R,b is not a member of set R
b âˆ‰ Z,b is not a member of set Z
c âˆˆ P âˆª R â†” (c âˆˆ P âˆ¨ c âˆˆ R),c is an element of P union R if and only if c is an element of P or c is an element of R
c âˆˆ Q \ V,c is an element of Q but not in V
c âˆˆ S \ P,c is an element of S but not in P
c âˆˆ Y \ R,c is an element of Y but not in R
c âˆˆ Bá¶œ â†” c âˆ‰ B,c is an element of the complement of B if and only if c is not in B
c âˆˆ Yá¶œ â†” c âˆ‰ Y,c is an element of the complement of Y if and only if c is not in Y
c âˆˆ P âˆ© T â†” (c âˆˆ P âˆ§ c âˆˆ T),c is an element of the intersection of P and T if and only if c is in both P and T
c âˆˆ R âˆ© W â†” (c âˆˆ R âˆ§ c âˆˆ W),c is an element of the intersection of R and W if and only if c is in both R and W
c âˆˆ S âˆ© C â†” (c âˆˆ S âˆ§ c âˆˆ C),c is an element of the intersection of S and C if and only if c is in both S and C
c âˆˆ U âˆ© T â†” (c âˆˆ U âˆ§ c âˆˆ T),c is an element of the intersection of U and T if and only if c is in both U and T
c âˆˆ X âˆ© W â†” (c âˆˆ X âˆ§ c âˆˆ W),c is an element of the intersection of X and W if and only if c is in both X and W
c âˆˆ X âˆ© Y â†” (c âˆˆ X âˆ§ c âˆˆ Y),c is an element of the intersection of X and Y if and only if c is in both X and Y
c âˆ‰ A,c is not a member of set A
c âˆ‰ B,c is not a member of set B
c âˆ‰ C,c is not a member of set C
c âˆ‰ R,c is not a member of set R
c âˆ‰ S,c is not a member of set S
c âˆ‰ W,c is not a member of set W
Pijective (f : C â†’ P),f is bijective from C to P
Rijective (f : P â†’ R),f is bijective from P to R
Xijective (f : P â†’ X),f is bijective from P to X
Vijective (f : R â†’ V),f is bijective from R to V
Yijective (f : R â†’ Y),f is bijective from R to Y
Tijective (f : S â†’ T),f is bijective from S to T
Xijective (f : T â†’ X),f is bijective from T to X
Pijective (f : U â†’ P),f is bijective from U to P
Vijective (f : U â†’ V),f is bijective from U to V
Tijective (f : X â†’ T),f is bijective from X to T
Tijective (f : Y â†’ T),f is bijective from Y to T
Xijective (f : Y â†’ X),f is bijective from Y to X
Bijective (f : Z â†’ B),f is bijective from Z to B
Injective (f : S â†’ Q),f is injective on S
Injective (f : T â†’ W),f is injective on T
Injective (f : V â†’ Q),f is injective on V
Injective (f : X â†’ P),f is injective on X
Injective (f : Y â†’ V),f is injective on Y
Surjective (f : A â†’ R),f is surjective from A to R
Surjective (f : Q â†’ R),f is surjective from Q to R
Surjective (f : R â†’ U),f is surjective from R to U
Surjective (f : T â†’ B),f is surjective from T to B
Surjective (f : U â†’ X),f is surjective from U to X
Surjective (f : U â†’ Y),f is surjective from U to Y
Surjective (f : V â†’ S),f is surjective from V to S
Surjective (f : V â†’ X),f is surjective from V to X
Surjective (f : W â†’ R),f is surjective from W to R
Surjective (f : Y â†’ X),f is surjective from Y to X
Surjective (f : Y â†’ Y),f is surjective from Y to Y
f : A â†’ W,f maps A into W
f : C â†’ P,f maps C into P
f : P â†’ C,f maps P into C
f : P â†’ U,f maps P into U
f : S â†’ T,f maps S into T
f : U â†’ V,f maps U into V
f : U â†’ W,f maps U into W
f : V â†’ C,f maps V into C
f : V â†’ Q,f maps V into Q
f : V â†’ W,f maps V into W
f : W â†’ S,f maps W into S
f : X â†’ T,f maps X into T
f : X â†’ X,f maps X into X
f : Y â†’ Z,f maps Y into Z
f : Z â†’ Q,f maps Z into Q
f : Z â†’ T,f maps Z into T
f : Z â†’ W,f maps Z into W
f : Z â†’ X,f maps Z into X
k âˆˆ C \ Z,k is an element of C but not in Z
k âˆˆ S \ C,k is an element of S but not in C
k âˆˆ S \ Q,k is an element of S but not in Q
k âˆˆ S âˆª Q â†” (k âˆˆ S âˆ¨ k âˆˆ Q),k is an element of S union Q if and only if k is an element of S or k is an element of Q
k âˆˆ Vá¶œ â†” k âˆ‰ V,k is an element of the complement of V if and only if k is not in V
k âˆˆ Zá¶œ â†” k âˆ‰ Z,k is an element of the complement of Z if and only if k is not in Z
k âˆˆ B âˆ© V â†” (k âˆˆ B âˆ§ k âˆˆ V),k is an element of the intersection of B and V if and only if k is in both B and V
k âˆˆ C âˆ© P â†” (k âˆˆ C âˆ§ k âˆˆ P),k is an element of the intersection of C and P if and only if k is in both C and P
k âˆˆ R âˆ© W â†” (k âˆˆ R âˆ§ k âˆˆ W),k is an element of the intersection of R and W if and only if k is in both R and W
k âˆ‰ C,k is not a member of set C
k âˆ‰ W,k is not a member of set W
k âˆ‰ X,k is not a member of set X
m âˆˆ B âˆª P â†” (m âˆˆ B âˆ¨ m âˆˆ P),m is an element of B union P if and only if m is an element of B or m is an element of P
m âˆˆ C \ Y,m is an element of C but not in Y
m âˆˆ P \ A,m is an element of P but not in A
m âˆˆ R âˆª V â†” (m âˆˆ R âˆ¨ m âˆˆ V),m is an element of R union V if and only if m is an element of R or m is an element of V
m âˆˆ T âˆª R â†” (m âˆˆ T âˆ¨ m âˆˆ R),m is an element of T union R if and only if m is an element of T or m is an element of R
m âˆˆ U âˆª Z â†” (m âˆˆ U âˆ¨ m âˆˆ Z),m is an element of U union Z if and only if m is an element of U or m is an element of Z
m âˆˆ V \ P,m is an element of V but not in P
m âˆˆ W \ S,m is an element of W but not in S
m âˆˆ W âˆª X â†” (m âˆˆ W âˆ¨ m âˆˆ X),m is an element of W union X if and only if m is an element of W or m is an element of X
m âˆˆ Y âˆª C â†” (m âˆˆ Y âˆ¨ m âˆˆ C),m is an element of Y union C if and only if m is an element of Y or m is an element of C
m âˆˆ Q âˆ© X â†” (m âˆˆ Q âˆ§ m âˆˆ X),m is an element of the intersection of Q and X if and only if m is in both Q and X
m âˆˆ S âˆ© Z â†” (m âˆˆ S âˆ§ m âˆˆ Z),m is an element of the intersection of S and Z if and only if m is in both S and Z
m âˆˆ X âˆ© R â†” (m âˆˆ X âˆ§ m âˆˆ R),m is an element of the intersection of X and R if and only if m is in both X and R
m âˆ‰ Q,m is not a member of set Q
m âˆ‰ X,m is not a member of set X
m âˆ‰ Y,m is not a member of set Y
n âˆˆ P âˆª X â†” (n âˆˆ P âˆ¨ n âˆˆ X),n is an element of P union X if and only if n is an element of P or n is an element of X
n âˆˆ R âˆª A â†” (n âˆˆ R âˆ¨ n âˆˆ A),n is an element of R union A if and only if n is an element of R or n is an element of A
n âˆˆ R âˆª Q â†” (n âˆˆ R âˆ¨ n âˆˆ Q),n is an element of R union Q if and only if n is an element of R or n is an element of Q
n âˆˆ T \ X,n is an element of T but not in X
n âˆˆ T âˆª W â†” (n âˆˆ T âˆ¨ n âˆˆ W),n is an element of T union W if and only if n is an element of T or n is an element of W
n âˆˆ U \ C,n is an element of U but not in C
n âˆˆ V \ U,n is an element of V but not in U
n âˆˆ V âˆª Q â†” (n âˆˆ V âˆ¨ n âˆˆ Q),n is an element of V union Q if and only if n is an element of V or n is an element of Q
n âˆˆ V âˆª R â†” (n âˆˆ V âˆ¨ n âˆˆ R),n is an element of V union R if and only if n is an element of V or n is an element of R
n âˆˆ Xá¶œ â†” n âˆ‰ X,n is an element of the complement of X if and only if n is not in X
n âˆˆ C âˆ© P â†” (n âˆˆ C âˆ§ n âˆˆ P),n is an element of the intersection of C and P if and only if n is in both C and P
n âˆˆ C âˆ© Y â†” (n âˆˆ C âˆ§ n âˆˆ Y),n is an element of the intersection of C and Y if and only if n is in both C and Y
n âˆˆ R âˆ© A â†” (n âˆˆ R âˆ§ n âˆˆ A),n is an element of the intersection of R and A if and only if n is in both R and A
n âˆˆ Z âˆ© V â†” (n âˆˆ Z âˆ§ n âˆˆ V),n is an element of the intersection of Z and V if and only if n is in both Z and V
n âˆ‰ R,n is not a member of set R
n âˆ‰ X,n is not a member of set X
n âˆ‰ Z,n is not a member of set Z
s âˆˆ A âˆª S â†” (s âˆˆ A âˆ¨ s âˆˆ S),s is an element of A union S if and only if s is an element of A or s is an element of S
s âˆˆ B \ R,s is an element of B but not in R
s âˆˆ P âˆª T â†” (s âˆˆ P âˆ¨ s âˆˆ T),s is an element of P union T if and only if s is an element of P or s is an element of T
s âˆˆ R \ V,s is an element of R but not in V
s âˆˆ T âˆª X â†” (s âˆˆ T âˆ¨ s âˆˆ X),s is an element of T union X if and only if s is an element of T or s is an element of X
s âˆˆ V âˆª A â†” (s âˆˆ V âˆ¨ s âˆˆ A),s is an element of V union A if and only if s is an element of V or s is an element of A
s âˆˆ V âˆª W â†” (s âˆˆ V âˆ¨ s âˆˆ W),s is an element of V union W if and only if s is an element of V or s is an element of W
s âˆˆ X \ P,s is an element of X but not in P
s âˆˆ Z âˆª P â†” (s âˆˆ Z âˆ¨ s âˆˆ P),s is an element of Z union P if and only if s is an element of Z or s is an element of P
s âˆˆ Z âˆª W â†” (s âˆˆ Z âˆ¨ s âˆˆ W),s is an element of Z union W if and only if s is an element of Z or s is an element of W
s âˆˆ Zá¶œ â†” s âˆ‰ Z,s is an element of the complement of Z if and only if s is not in Z
s âˆˆ P âˆ© Y â†” (s âˆˆ P âˆ§ s âˆˆ Y),s is an element of the intersection of P and Y if and only if s is in both P and Y
s âˆˆ X âˆ© R â†” (s âˆˆ X âˆ§ s âˆˆ R),s is an element of the intersection of X and R if and only if s is in both X and R
s âˆ‰ S,s is not a member of set S
s âˆ‰ T,s is not a member of set T
t âˆˆ A âˆª U â†” (t âˆˆ A âˆ¨ t âˆˆ U),t is an element of A union U if and only if t is an element of A or t is an element of U
t âˆˆ B âˆª X â†” (t âˆˆ B âˆ¨ t âˆˆ X),t is an element of B union X if and only if t is an element of B or t is an element of X
t âˆˆ C \ U,t is an element of C but not in U
t âˆˆ R \ S,t is an element of R but not in S
t âˆˆ X âˆª A â†” (t âˆˆ X âˆ¨ t âˆˆ A),t is an element of X union A if and only if t is an element of X or t is an element of A
t âˆˆ Y \ B,t is an element of Y but not in B
t âˆˆ Y âˆª C â†” (t âˆˆ Y âˆ¨ t âˆˆ C),t is an element of Y union C if and only if t is an element of Y or t is an element of C
t âˆˆ Aá¶œ â†” t âˆ‰ A,t is an element of the complement of A if and only if t is not in A
t âˆˆ Pá¶œ â†” t âˆ‰ P,t is an element of the complement of P if and only if t is not in P
t âˆˆ Vá¶œ â†” t âˆ‰ V,t is an element of the complement of V if and only if t is not in V
t âˆˆ Wá¶œ â†” t âˆ‰ W,t is an element of the complement of W if and only if t is not in W
t âˆˆ P âˆ© Q â†” (t âˆˆ P âˆ§ t âˆˆ Q),t is an element of the intersection of P and Q if and only if t is in both P and Q
t âˆˆ S âˆ© A â†” (t âˆˆ S âˆ§ t âˆˆ A),t is an element of the intersection of S and A if and only if t is in both S and A
t âˆˆ S âˆ© P â†” (t âˆˆ S âˆ§ t âˆˆ P),t is an element of the intersection of S and P if and only if t is in both S and P
t âˆˆ V âˆ© X â†” (t âˆˆ V âˆ§ t âˆˆ X),t is an element of the intersection of V and X if and only if t is in both V and X
t âˆ‰ A,t is not a member of set A
t âˆ‰ W,t is not a member of set W
t âˆ‰ Z,t is not a member of set Z
u âˆˆ B \ Q,u is an element of B but not in Q
u âˆˆ Q \ Z,u is an element of Q but not in Z
u âˆˆ Q âˆª A â†” (u âˆˆ Q âˆ¨ u âˆˆ A),u is an element of Q union A if and only if u is an element of Q or u is an element of A
u âˆˆ T âˆª Y â†” (u âˆˆ T âˆ¨ u âˆˆ Y),u is an element of T union Y if and only if u is an element of T or u is an element of Y
u âˆˆ V \ T,u is an element of V but not in T
u âˆˆ V âˆª T â†” (u âˆˆ V âˆ¨ u âˆˆ T),u is an element of V union T if and only if u is an element of V or u is an element of T
u âˆˆ W \ X,u is an element of W but not in X
u âˆˆ W âˆª T â†” (u âˆˆ W âˆ¨ u âˆˆ T),u is an element of W union T if and only if u is an element of W or u is an element of T
u âˆˆ X \ V,u is an element of X but not in V
u âˆˆ Y âˆª U â†” (u âˆˆ Y âˆ¨ u âˆˆ U),u is an element of Y union U if and only if u is an element of Y or u is an element of U
u âˆˆ Y âˆª X â†” (u âˆˆ Y âˆ¨ u âˆˆ X),u is an element of Y union X if and only if u is an element of Y or u is an element of X
u âˆˆ Z \ Y,u is an element of Z but not in Y
u âˆˆ S âˆ© Y â†” (u âˆˆ S âˆ§ u âˆˆ Y),u is an element of the intersection of S and Y if and only if u is in both S and Y
u âˆˆ X âˆ© Y â†” (u âˆˆ X âˆ§ u âˆˆ Y),u is an element of the intersection of X and Y if and only if u is in both X and Y
v âˆˆ C âˆª Z â†” (v âˆˆ C âˆ¨ v âˆˆ Z),v is an element of C union Z if and only if v is an element of C or v is an element of Z
v âˆˆ P âˆª Y â†” (v âˆˆ P âˆ¨ v âˆˆ Y),v is an element of P union Y if and only if v is an element of P or v is an element of Y
v âˆˆ Q \ A,v is an element of Q but not in A
v âˆˆ Q âˆª P â†” (v âˆˆ Q âˆ¨ v âˆˆ P),v is an element of Q union P if and only if v is an element of Q or v is an element of P
v âˆˆ R âˆª Y â†” (v âˆˆ R âˆ¨ v âˆˆ Y),v is an element of R union Y if and only if v is an element of R or v is an element of Y
v âˆˆ S âˆª P â†” (v âˆˆ S âˆ¨ v âˆˆ P),v is an element of S union P if and only if v is an element of S or v is an element of P
v âˆˆ T \ W,v is an element of T but not in W
v âˆˆ V \ T,v is an element of V but not in T
v âˆˆ Z âˆª S â†” (v âˆˆ Z âˆ¨ v âˆˆ S),v is an element of Z union S if and only if v is an element of Z or v is an element of S
v âˆˆ Bá¶œ â†” v âˆ‰ B,v is an element of the complement of B if and only if v is not in B
v âˆˆ Qá¶œ â†” v âˆ‰ Q,v is an element of the complement of Q if and only if v is not in Q
v âˆˆ Rá¶œ â†” v âˆ‰ R,v is an element of the complement of R if and only if v is not in R
v âˆˆ P âˆ© S â†” (v âˆˆ P âˆ§ v âˆˆ S),v is an element of the intersection of P and S if and only if v is in both P and S
v âˆˆ Q âˆ© W â†” (v âˆˆ Q âˆ§ v âˆˆ W),v is an element of the intersection of Q and W if and only if v is in both Q and W
v âˆˆ S âˆ© A â†” (v âˆˆ S âˆ§ v âˆˆ A),v is an element of the intersection of S and A if and only if v is in both S and A
v âˆˆ W âˆ© U â†” (v âˆˆ W âˆ§ v âˆˆ U),v is an element of the intersection of W and U if and only if v is in both W and U
v âˆˆ X âˆ© S â†” (v âˆˆ X âˆ§ v âˆˆ S),v is an element of the intersection of X and S if and only if v is in both X and S
v âˆ‰ A,v is not a member of set A
v âˆ‰ B,v is not a member of set B
v âˆ‰ P,v is not a member of set P
v âˆ‰ R,v is not a member of set R
v âˆ‰ T,v is not a member of set T
v âˆ‰ W,v is not a member of set W
v âˆ‰ Y,v is not a member of set Y
w âˆˆ B âˆª Q â†” (w âˆˆ B âˆ¨ w âˆˆ Q),w is an element of B union Q if and only if w is an element of B or w is an element of Q
w âˆˆ U âˆª T â†” (w âˆˆ U âˆ¨ w âˆˆ T),w is an element of U union T if and only if w is an element of U or w is an element of T
w âˆˆ V âˆª T â†” (w âˆˆ V âˆ¨ w âˆˆ T),w is an element of V union T if and only if w is an element of V or w is an element of T
w âˆˆ X \ T,w is an element of X but not in T
w âˆˆ X \ Y,w is an element of X but not in Y
w âˆˆ Vá¶œ â†” w âˆ‰ V,w is an element of the complement of V if and only if w is not in V
w âˆˆ Yá¶œ â†” w âˆ‰ Y,w is an element of the complement of Y if and only if w is not in Y
w âˆˆ C âˆ© A â†” (w âˆˆ C âˆ§ w âˆˆ A),w is an element of the intersection of C and A if and only if w is in both C and A
