Symbolic_Maths,Natural_Language
w âˆˆ P âˆ© U â†” (w âˆˆ P âˆ§ w âˆˆ U),w is an element of the intersection of P and U if and only if w is in both P and U
w âˆˆ S âˆ© V â†” (w âˆˆ S âˆ§ w âˆˆ V),w is an element of the intersection of S and V if and only if w is in both S and V
w âˆ‰ X,w is not a member of set X
x âˆˆ C âˆª U â†” (x âˆˆ C âˆ¨ x âˆˆ U),x is an element of C union U if and only if x is an element of C or x is an element of U
x âˆˆ V âˆª Q â†” (x âˆˆ V âˆ¨ x âˆˆ Q),x is an element of V union Q if and only if x is an element of V or x is an element of Q
x âˆˆ Sá¶œ â†” x âˆ‰ S,x is an element of the complement of S if and only if x is not in S
x âˆˆ Uá¶œ â†” x âˆ‰ U,x is an element of the complement of U if and only if x is not in U
x âˆˆ Vá¶œ â†” x âˆ‰ V,x is an element of the complement of V if and only if x is not in V
x âˆˆ Xá¶œ â†” x âˆ‰ X,x is an element of the complement of X if and only if x is not in X
x âˆˆ V âˆ© B â†” (x âˆˆ V âˆ§ x âˆˆ B),x is an element of the intersection of V and B if and only if x is in both V and B
x âˆ‰ Q,x is not a member of set Q
x âˆ‰ T,x is not a member of set T
x âˆ‰ U,x is not a member of set U
x âˆ‰ V,x is not a member of set V
y âˆˆ B \ Q,y is an element of B but not in Q
y âˆˆ B âˆª P â†” (y âˆˆ B âˆ¨ y âˆˆ P),y is an element of B union P if and only if y is an element of B or y is an element of P
y âˆˆ P \ V,y is an element of P but not in V
y âˆˆ P âˆª T â†” (y âˆˆ P âˆ¨ y âˆˆ T),y is an element of P union T if and only if y is an element of P or y is an element of T
y âˆˆ P âˆª U â†” (y âˆˆ P âˆ¨ y âˆˆ U),y is an element of P union U if and only if y is an element of P or y is an element of U
y âˆˆ Q \ U,y is an element of Q but not in U
y âˆˆ U âˆª S â†” (y âˆˆ U âˆ¨ y âˆˆ S),y is an element of U union S if and only if y is an element of U or y is an element of S
y âˆˆ W âˆª V â†” (y âˆˆ W âˆ¨ y âˆˆ V),y is an element of W union V if and only if y is an element of W or y is an element of V
y âˆˆ Aá¶œ â†” y âˆ‰ A,y is an element of the complement of A if and only if y is not in A
y âˆˆ Sá¶œ â†” y âˆ‰ S,y is an element of the complement of S if and only if y is not in S
y âˆˆ Zá¶œ â†” y âˆ‰ Z,y is an element of the complement of Z if and only if y is not in Z
y âˆˆ R âˆ© T â†” (y âˆˆ R âˆ§ y âˆˆ T),y is an element of the intersection of R and T if and only if y is in both R and T
y âˆˆ R âˆ© Y â†” (y âˆˆ R âˆ§ y âˆˆ Y),y is an element of the intersection of R and Y if and only if y is in both R and Y
y âˆˆ V âˆ© Z â†” (y âˆˆ V âˆ§ y âˆˆ Z),y is an element of the intersection of V and Z if and only if y is in both V and Z
y âˆˆ X âˆ© V â†” (y âˆˆ X âˆ§ y âˆˆ V),y is an element of the intersection of X and V if and only if y is in both X and V
y âˆˆ Y âˆ© R â†” (y âˆˆ Y âˆ§ y âˆˆ R),y is an element of the intersection of Y and R if and only if y is in both Y and R
y âˆˆ Z âˆ© B â†” (y âˆˆ Z âˆ§ y âˆˆ B),y is an element of the intersection of Z and B if and only if y is in both Z and B
y âˆˆ Z âˆ© Q â†” (y âˆˆ Z âˆ§ y âˆˆ Q),y is an element of the intersection of Z and Q if and only if y is in both Z and Q
y âˆ‰ C,y is not a member of set C
y âˆ‰ Q,y is not a member of set Q
y âˆ‰ R,y is not a member of set R
y âˆ‰ X,y is not a member of set X
y âˆ‰ Z,y is not a member of set Z
z âˆˆ S âˆª A â†” (z âˆˆ S âˆ¨ z âˆˆ A),z is an element of S union A if and only if z is an element of S or z is an element of A
z âˆˆ S âˆª B â†” (z âˆˆ S âˆ¨ z âˆˆ B),z is an element of S union B if and only if z is an element of S or z is an element of B
z âˆˆ T âˆª Q â†” (z âˆˆ T âˆ¨ z âˆˆ Q),z is an element of T union Q if and only if z is an element of T or z is an element of Q
z âˆˆ X âˆª P â†” (z âˆˆ X âˆ¨ z âˆˆ P),z is an element of X union P if and only if z is an element of X or z is an element of P
z âˆˆ Y âˆª A â†” (z âˆˆ Y âˆ¨ z âˆˆ A),z is an element of Y union A if and only if z is an element of Y or z is an element of A
z âˆˆ Y âˆª Z â†” (z âˆˆ Y âˆ¨ z âˆˆ Z),z is an element of Y union Z if and only if z is an element of Y or z is an element of Z
z âˆˆ Bá¶œ â†” z âˆ‰ B,z is an element of the complement of B if and only if z is not in B
z âˆˆ Qá¶œ â†” z âˆ‰ Q,z is an element of the complement of Q if and only if z is not in Q
z âˆˆ Vá¶œ â†” z âˆ‰ V,z is an element of the complement of V if and only if z is not in V
z âˆˆ B âˆ© T â†” (z âˆˆ B âˆ§ z âˆˆ T),z is an element of the intersection of B and T if and only if z is in both B and T
z âˆˆ T âˆ© S â†” (z âˆˆ T âˆ§ z âˆˆ S),z is an element of the intersection of T and S if and only if z is in both T and S
z âˆˆ T âˆ© W â†” (z âˆˆ T âˆ§ z âˆˆ W),z is an element of the intersection of T and W if and only if z is in both T and W
z âˆˆ V âˆ© R â†” (z âˆˆ V âˆ§ z âˆˆ R),z is an element of the intersection of V and R if and only if z is in both V and R
z âˆˆ V âˆ© U â†” (z âˆˆ V âˆ§ z âˆˆ U),z is an element of the intersection of V and U if and only if z is in both V and U
z âˆˆ W âˆ© V â†” (z âˆˆ W âˆ§ z âˆˆ V),z is an element of the intersection of W and V if and only if z is in both W and V
z âˆˆ X âˆ© Y â†” (z âˆˆ X âˆ§ z âˆˆ Y),z is an element of the intersection of X and Y if and only if z is in both X and Y
z âˆ‰ B,z is not a member of set B
z âˆ‰ Q,z is not a member of set Q
z âˆ‰ X,z is not a member of set X
A âˆª âˆ… = A,The union of A and the empty set equals A
A âˆ© âˆ… = âˆ…,The intersection of A and the empty set equals the empty set
A âˆª U = U,The union of A and the universal set equals the universal set
A âˆ© U = A,The intersection of A and the universal set equals A
A âˆª Aá¶œ = U,The union of A and its complement equals the universal set
A âˆ© Aá¶œ = âˆ…,The intersection of A and its complement equals the empty set
âˆ…á¶œ = U,The complement of the empty set is the universal set
Uá¶œ = âˆ…,The complement of the universal set is the empty set
A âˆª A = A,The union of A with itself equals A
A âˆ© A = A,The intersection of A with itself equals A
A âˆª B = B âˆª A,Union is commutative
A âˆ© B = B âˆ© A,Intersection is commutative
(A âˆª B) âˆª C = A âˆª (B âˆª C),Union is associative
(A âˆ© B) âˆ© C = A âˆ© (B âˆ© C),Intersection is associative
A \ B = A âˆ© Bá¶œ,Set difference equals intersection with complement
A \ âˆ… = A,The difference of A and the empty set equals A
âˆ… \ A = âˆ…,The difference of the empty set and A equals the empty set
A \ A = âˆ…,The difference of A and itself equals the empty set
A âŠ† B â†” A âˆª B = B,A is a subset of B if and only if their union equals B
A âŠ† B â†” A âˆ© B = A,A is a subset of B if and only if their intersection equals A
A âŠ† B â†” A âˆ© Bá¶œ = âˆ…,A is a subset of B if and only if A intersected with the complement of B is empty
A \ (B âˆª C) = (A \ B) âˆ© (A \ C),Set difference distributes over union
A \ (B âˆ© C) = (A \ B) âˆª (A \ C),Set difference anti-distributes over intersection
|ğ’«(A)| = 2^|A|,The cardinality of the power set of A equals 2 to the power of the cardinality of A
A âŠ† B â†’ ğ’«(A) âŠ† ğ’«(B),If A is a subset of B then the power set of A is a subset of the power set of B
A âŠ† B â†” âˆ€x (x âˆˆ A â†’ x âˆˆ B),"A is a subset of B if and only if for all x, if x is an element of A then x is an element of B"
A = B â†” âˆ€x (x âˆˆ A â†” x âˆˆ B),"A equals B if and only if for all x, x is an element of A if and only if x is an element of B"
A âˆ© B = âˆ… â†” A and B are disjoint,A intersected with B equals the empty set if and only if A and B are disjoint
